"Decretos";"Localidade";"Ementa";"Estado";"Tipo";"Tipo_Documento";"Cod_UF";"Nome_Mesorregião";"Codigo_Municipio";"Decretos_date"
"Decreto Nº 40601 de 7 de abril de 2020";"Distrito Federal";"Dispõe sobre a obrigatoriedade de notificação de dados de pacientes que se submeteram ao teste de sorologia para o COVID-19 ou que possuem sintomas suspeitos, detectados por profissionais de saúde, no Distrito Federal.";"Distrito Federal";"Estadual";"Decreto";NA;NA;NA;2020-04-07
"Decreto Nº 40604 de 7 de abril de 2020";"Distrito Federal";"Altera o Decreto nº 40.559, de 24 de março de 2020, que Institui o Comitê de Emergência COVID-19 para arrecadar doações destinadas ao combate e enfrentamento do novo Coronavírus (COVID-19), e dá outras providências.";"Distrito Federal";"Estadual";"Decreto";NA;NA;NA;2020-04-07
"Decreto Nº 40584 de 1 de abril de 2020";"Distrito Federal";"Institui medidas de transparência e prioridade aos processos relativos à atual situação de emergência em saúde pública e pandemia declarada pela Organização Mundial de Saúde (OMS), em decorrência do novo coronavírus (COVID-19), e dá outras providências.";"Distrito Federal";"Estadual";"Decreto";NA;NA;NA;2020-04-01
"Decreto Nº 40583 de 1 de abril de 2020";"Distrito Federal";"Dispõe sobre as medidas para enfrentamento da emergência de saúde pública de importância internacional decorrente do novo coronavírus.";"Distrito Federal";"Estadual";"Decreto";NA;NA;NA;2020-04-01
"Decreto Nº 40586 de 1 de abril de 2020";"Distrito Federal";"Dispõe sobre o adiamento das Comemorações aos 60 Anos de Brasília.";"Distrito Federal";"Estadual";"Decreto";NA;NA;NA;2020-04-01
"Decreto Nº 40572 de 28 de março de 2020";"Distrito Federal";"Suspende, por tempo indeterminado, a posse e o exercício dos candidatos aprovados em concursos públicos, no âmbito do Distrito Federal e dá outras providências.";"Distrito Federal";"Estadual";"Decreto";NA;NA;NA;2020-03-28
"Decreto Nº 40571 de 28 de março de 2020";"Distrito Federal";"Altera o Decreto nº 40.559, de 24 de março de 2020, que institui o Comitê de Emergência COVID-19 para arrecadar doações destinadas ao combate e enfrentamento do novo Coronavírus (COVID-19), e dá outras providências.";"Distrito Federal";"Estadual";"Decreto";NA;NA;NA;2020-03-28
"Decreto Nº 40557 de 24 de março de 2020";"Distrito Federal";"Altera o inciso VI do art. 3º do Decreto nº 40.550, de 23 de março de 2020, que dispõe sobre as medidas para enfrentamento da emergência de saúde pública de importância internacional decorrente do novo coronavírus.";"Distrito Federal";"Estadual";"Decreto";NA;NA;NA;2020-03-24
"Decreto Nº 40559 de 24 de março de 2020";"Distrito Federal";"Institui o Comitê de Emergência COVID-19 para arrecadar doações destinadas ao combate e enfrentamento do novo Coronavírus (COVID-19), e dá outras providências.";"Distrito Federal";"Estadual";"Decreto";NA;NA;NA;2020-03-24
"Decreto Nº 40550 de 23 de março de 2020";"Distrito Federal";"Dispõe sobre as medidas para enfrentamento da emergência de saúde pública de importância internacional decorrente do novo coronavírus, e dá outras providências.";"Distrito Federal";"Estadual";"Decreto";NA;NA;NA;2020-03-23
"Decreto Nº 40547 de 20 de março de 2020";"Distrito Federal";"Promove a destinação das instalações e equipamentos do Centro Médico de Polícia Militar do Distrito Federal para o atendimento geral à população durante o período de combate à pandemia causada pelo vírus SARS-CoV-2 (COVID-19), determina a prestação isonômica de serviços médicos na citada unidade, transfere a administração da citada unidade de saúde para a Secretaria de Saúde e requisita os serviços da força de trabalho do IGES, e dá outras providências.";"Distrito Federal";"Estadual";"Decreto";NA;NA;NA;2020-03-20
"Decreto Nº 40546 de 20 de março de 2020";"Distrito Federal";"Dispõe sobre o teletrabalho, em caráter excepcional e provisório, para os órgãos da administração pública direta, indireta, autárquica e fundacional do Distrito Federal, a partir de 23 de março de 2020, como medida necessária à continuidade do funcionamento da administração pública distrital, em virtude da atual situação de emergência em saúde pública e pandemia declarada pela Organização Mundial de Saúde (OMS), em decorrência do coronavírus (COVID-19), e dá outras providências.";"Distrito Federal";"Estadual";"Decreto";NA;NA;NA;2020-03-20
"Decreto Nº 40548 de 20 de março de 2020";"Distrito Federal";"Dispõe sobre a suspensão dos serviços de coleta seletiva, triagem de resíduos recicláveis e compostagem no âmbito do Distrito Federal.";"Distrito Federal";"Estadual";"Decreto";NA;NA;NA;2020-03-20
"Lei Ordinária Nº 6521 de 19 de março de 2020";"Distrito Federal";"Dispõe sobre a redução de alíquota do ICMS nas operações que especifica, e dá outras providências.";"Distrito Federal";"Estadual";"Lei";NA;NA;NA;2020-03-19
"Decreto Nº 40529 de 18 de março de 2020";"Distrito Federal";"Altera o Decreto 40.520, de 14 de março de 2020, que dispõe sobre as medidas para enfrentamento da emergência de saúde pública de importância internacional decorrente do novo coronavírus, e dá outras providências.";"Distrito Federal";"Estadual";"Decreto";NA;NA;NA;2020-03-18
"Decreto Nº 40531 de 18 de março de 2020";"Distrito Federal";"Altera o Decreto nº 40.525, de 17 de março de 2020, que Institui Grupo Econômico para acompanhamento e apresentação de propostas de ações, face às medidas temporárias de prevenção ao contágio pelo novo Coronavírus (COVID 19).";"Distrito Federal";"Estadual";"Decreto";NA;NA;NA;2020-03-18
"Decreto Nº 40526 de 17 de março de 2020";"Distrito Federal";"Estabelece orientações aos órgãos e entidades sobre medidas temporárias para o teletrabalho de servidores, em função da prevenção ao contágio pelo Novo Coronavírus (COVID-19), considerando a classificação de pandemia pela Organização Mundial de Saúde (OMS).";"Distrito Federal";"Estadual";"Decreto";NA;NA;NA;2020-03-17
"Decreto Nº 40525 de 17 de março de 2020";"Distrito Federal";"Institui Grupo Econômico para acompanhamento e apresentação de propostas de ações, face às medidas temporárias de prevenção ao contágio pelo novo Coronavírus (COVID 19), considerando a classificação de pandemia pela Organização Mundial da Saúde - OMS.";"Distrito Federal";"Estadual";"Decreto";NA;NA;NA;2020-03-17
"Decreto Nº 40519 de 14 de março de 2020";"Distrito Federal";"Dispõe sobre a vigilância epidemiológica e a necessária comunicação, por hospitais e laboratórios, às autoridades sanitárias do Distrito Federal, dos laboratórios que realizam os exames clínicos para a descoberta do COVID-19, no âmbito do Distrito Federal.";"Distrito Federal";"Estadual";"Decreto";NA;NA;NA;2020-03-14
"Decreto Nº 40520 de 14 de março de 2020";"Distrito Federal";"Dispõe sobre as medidas para enfrentamento da emergência de saúde pública de importância internacional decorrente do novo coronavírus, e dá outras providências.";"Distrito Federal";"Estadual";"Decreto";NA;NA;NA;2020-03-14
"Decreto Nº 40512 de 13 de março de 2020";"Distrito Federal";"Cria o Grupo Executivo para o desenvolvimento de ações de prevenção e mitigação ao COVID-19 e à Dengue, adota medidas de contenção e enfrentamento de ambas as enfermidades no âmbito do Distrito Federal, e dá outras providências.";"Distrito Federal";"Estadual";"Decreto";NA;NA;NA;2020-03-13
"Decreto Nº 40510 de 12 de março de 2020";"Distrito Federal";"Altera o Decreto nº 40.509, de 11 de março de 2020, que dispõe sobre as medidas para enfrentamento da emergência de saúde pública de importância internacional decorrente do Novo Coronavírus, e dá outras providências.";"Distrito Federal";"Estadual";"Decreto";NA;NA;NA;2020-03-12
"Decreto Nº 40509 de 11 de março de 2020";"Distrito Federal";"Dispõe sobre as medidas para enfrentamento da emergência de saúde pública de importância internacional decorrente do novo coronavírus, e dá outras providências.";"Distrito Federal";"Estadual";"Decreto";NA;NA;NA;2020-03-11
"Lei Ordinária Nº 9670 de 25 de agosto de 2020";"Vitória";"INSTITUI A FLEXIBILIZAÇÃO DOS HORÁRIOS DE FUNCIONAMENTO DO COMÉRCIO NÃO ESSENCIAL NO MUNICÍPIO DE VITÓRIA NO PERÍODO DA PANDEMIA DO COVID-19 E DÁ OUTRAS PROVIDÊNCIAS.";"Espírito Santo";"Municipal";"Lei";32;"Central Espírito-santense";3205309;2020-08-25
"Lei Ordinária Nº 9662 de 12 de agosto de 2020";"Vitória";"DISPÕE SOBRE A IMPLANTAÇÃO DE CAIXAS COLETORAS DE MÁSCARAS USADAS NO ÂMBITO DO MUNICÍPIO DE VITÓRIA E DÁ OUTRAS PROVIDÊNCIAS.";"Espírito Santo";"Municipal";"Lei";32;"Central Espírito-santense";3205309;2020-08-12
"Lei Ordinária Nº 9654 de 7 de agosto de 2020";"Vitória";"DISPÕE SOBRE A OBRIGATORIEDADE DO USO DE MÁSCARAS DE PROTEÇÃO NOS LOGRADOUROS PÚBLICOS, TRANSPORTES E NOS ESTABELECIMENTOS ESSENCIAIS, ONDE HÁ CONTATO DIRETO COM O PÚBLICO, PELO PERÍODO DE DURAÇÃO DA SITUAÇÃO DE EMERGÊNCIA EM RAZÃO DA PANDEMIA DO NOVO CORONAVÍRUS (COVID-19) E DÁ OUTRAS PROVIDÊNCIAS.";"Espírito Santo";"Municipal";"Lei";32;"Central Espírito-santense";3205309;2020-08-07
"Lei Ordinária Nº 9651 de 7 de agosto de 2020";"Vitória";"DISPÕE SOBRE A PROTEÇÃO DE MULHERES EM SITUAÇÃO DE VIOLÊNCIA DURANTE A VIGÊNCIA DO ESTADO DE CALAMIDADE PÚBLICA, COM EFEITOS ATÉ 31 DE DEZEMBRO DE 2020, OU ENQUANTO DURAREM MEDIDAS DE QUARENTENA E RESTRIÇÕES DE ATIVIDADES NO CONTEXTO DA PANDEMIA DO COVID-19 (NOVO CORONAVÍRUS).";"Espírito Santo";"Municipal";"Lei";32;"Central Espírito-santense";3205309;2020-08-07
"Decreto Nº 4692 de 22 de julho de 2020";"Espírito Santo";"Introduz alterações no Decreto nº 4623-R, de 4 de abril de 2020, que estabelece medidas de estímulo à Economia, para o enfrentamento do estado de calamidade pública reconhecido pelo Decreto Legislativo nº 01, de 27 de março de 2020, em decorrência da pandemia do novo coronavírus (COVID-19).";"Espírito Santo";"Estadual";"Decreto";NA;NA;NA;2020-07-22
"Lei Ordinária Nº 9647 de 6 de julho de 2020";"Vitória";"Institui auxílio emergencial municipal para pessoas em situação de vulnerabilidade social agravada pela pandemia da doença infecciosa viral respiratória - COVID-19, e dá outras providências.";"Espírito Santo";"Municipal";"Lei";32;"Central Espírito-santense";3205309;2020-07-06
"Lei Ordinária Nº 11144 de 22 de junho de 2020";"Espírito Santo";"Dispõe sobre a redução proporcional das mensalidades da rede privada de ensino durante o plano de contingência do novo coronavírus da Secretaria de Estado da Saúde.";"Espírito Santo";"Estadual";"Lei";NA;NA;NA;2020-06-22
"Lei Ordinária Nº 9640 de 3 de junho de 2020";"Vitória";"INSTITUI O REGIME EMERGENCIAL DE OPERAÇÃO E CUSTEIO DO TRANSPORTE PÚBLICO COLETIVO, PARA O ENFRENTAMENTO ECONÔMICO E SOCIAL DA EMERGÊNCIA EM SAÚDE PÚBLICA DECORRENTE DE OCORRÊNCIA DE PANDEMIA DE COVID-19, RECONHECIDA PELO PODER EXECUTIVO MUNICIPAL.";"Espírito Santo";"Municipal";"Lei";32;"Central Espírito-santense";3205309;2020-06-03
"Decreto Nº 4660 de 1 de junho de 2020";"Espírito Santo";"Introduz alterações no RICMS/ ES, aprovado pelo Decreto nº 1.090-R, de 25 de outubro de 2002.";"Espírito Santo";"Estadual";"Decreto";NA;NA;NA;2020-06-01
"Decreto Nº 4661 de 1 de junho de 2020";"Espírito Santo";"Altera o Decreto nº 4623-R, de 4 de abril de 2020, que estabelece medidas de estímulo à Economia, para o enfrentamento da pandemia do novo coronavírus (COVID-19).";"Espírito Santo";"Estadual";"Decreto";NA;NA;NA;2020-06-01
"Decreto Nº 4634 de 16 de abril de 2020";"Espírito Santo";"Altera o Decreto nº 4623-R, de 4 de abril de 2020, que estabelece medidas de estímulo à Economia, para o enfrentamento do estado de calamidade pública reconhecido pelo Decreto Legislativo nº 01, de 27 de março de 2020, em decorrência da pandemia do novo coronavírus (COVID-19).";"Espírito Santo";"Estadual";"Decreto";NA;NA;NA;2020-04-16
"Decreto Nº 4633 de 16 de abril de 2020";"Espírito Santo";"Introduz alterações no RICMS/ES, aprovado pelo Decreto nº 1.090-R, de 25 de outubro de 2002.";"Espírito Santo";"Estadual";"Decreto";NA;NA;NA;2020-04-16
"Lei Ordinária Nº 11125 de 6 de abril de 2020";"Espírito Santo";"Autoriza o Estado a participar do fundo privado a ser criado pelo Banco de Desenvolvimento do Espírito Santo - BANDES com a finalidade de garantir diretamente o risco em operações de crédito, concede subsídio financeiro, e dá outras providências.";"Espírito Santo";"Estadual";"Lei";NA;NA;NA;2020-04-06
"Lei Complementar Nº 950 de 6 de abril de 2020";"Espírito Santo";"Autoriza a aplicação dos recursos provenientes da Lei Complementar nº 712, de 13 de setembro de 2013, em despesas de custeio nas áreas de saúde e da assistência social enquanto perdurar o Estado de Emergência em Saúde Pública, em decorrência da Pandemia do novo coronavírus (COVID-19).";"Espírito Santo";"Estadual";"Lei";NA;NA;NA;2020-04-06
"Decreto Nº 4624 de 4 de abril de 2020";"Espírito Santo";"Introduz alterações no RICMS/ES, aprovado pelo Decreto nº 1.090-R, de 25 de outubro de 2002.";"Espírito Santo";"Estadual";"Decreto";NA;NA;NA;2020-04-04
"Decreto Nº 4623 de 4 de abril de 2020";"Espírito Santo";"Estabelece medidas de estímulo à Economia, para o enfrentamento do estado de calamidade pública reconhecido pelo Decreto Legislativo nº 01, de 27 de março de 2020, em decorrência da pandemia do novo coronavírus (COVID-19).";"Espírito Santo";"Estadual";"Decreto";NA;NA;NA;2020-04-04
"Decreto Nº 4625 de 4 de abril de 2020";"Espírito Santo";"Dispõe sobre medidas para enfrentamento da emergência de saúde pública decorrente do novo coronavírus (COVID-19), e dá outras providências.";"Espírito Santo";"Estadual";"Decreto";NA;NA;NA;2020-04-04
"Decreto Nº 446 de 2 de abril de 2020";"Espírito Santo";"Declara Estado de Calamidade Pública no Estado do Espírito Santo decorrente de desastre natural classificado como grupo biológico/epidemias e tipo doenças infecciosas virais (COBRADE 1.5.1.1.0).";"Espírito Santo";"Estadual";"Decreto";NA;NA;NA;2020-04-02
"Decreto Nº 4621 de 2 de abril de 2020";"Espírito Santo";"Dispõe sobre medidas para enfrentamento da emergência de saúde pública decorrente do novo coronavírus (COVID-19), e dá outras providências.";"Espírito Santo";"Estadual";"Decreto";NA;NA;NA;2020-04-02
"Lei Complementar Nº 946 de 27 de março de 2020";"Espírito Santo";"Dispõe sobre procedimentos para contratações e outras medidas para enfrentamento da calamidade de saúde pública e estado de emergência decorrentes do novo coronavírus (COVID-19) e dá outras providências.";"Espírito Santo";"Estadual";"Lei";NA;NA;NA;2020-03-27
"Decreto Nº 4607 de 22 de março de 2020";"Espírito Santo";"Dispõe sobre a infringência as determinações constantes em Decretos e demais atos expedidos por autoridades estaduais que veiculam medidas para enfrentamento da emergência de saúde pública decorrente do novo coronavírus (COVID-19), altera o Decreto nº 4.605-R, de 20 de março de 2020, e dá outras providências.";"Espírito Santo";"Estadual";"Decreto";NA;NA;NA;2020-03-22
"Decreto Nº 4599 de 17 de março de 2020";"Espírito Santo";"Dispõe sobre as medidas para enfrentamento da emergência de saúde pública decorrente do coronavírus (COVID-19) em diferentes áreas, e dá outras providências.";"Espírito Santo";"Estadual";"Decreto";NA;NA;NA;2020-03-17
"Lei Ordinária Nº 20840 de 2 de setembro de 2020";"Goiás";"Suspende, extraordinariamente as medidas administrativas que especifica.";"Goiás";"Estadual";"Lei";NA;NA;NA;2020-09-02
"Decreto Nº 9708 de 2 de setembro de 2020";"Goiás";"Regulamenta o Programa Social de Formação, Qualificação e Habilitação Profissional de Condutores de Veículos Automotores instituído pela Lei nº 20.637, de 12 de novembro de 2019.";"Goiás";"Estadual";"Decreto";NA;NA;NA;2020-09-02
"Lei Ordinária Nº 10506 de 13 de agosto de 2020";"Goiânia";"Dispõe sobre a aplicação de penalidade pela prática de elevação abusiva de preços enquanto vigorar a situação de calamidade pública no Município de Goiânia e dá outras providências.";"Goiás";"Municipal";"Lei";52;"Centro Goiano";5208707;2020-08-13
"Lei Ordinária Nº 20821 de 4 de agosto de 2020";"Goiás";"Dispõe sobre as diretrizes orçamentárias para o exercício de 2021 e dá outras providências.";"Goiás";"Estadual";"Lei";NA;NA;NA;2020-08-04
"Lei Ordinária Nº 20817 de 27 de julho de 2020";"Goiás";"Abre crédito extraordinário em favor do Fundo Estadual de Saúde - FES, no valor de R$ 304.142.302,29 (trezentos e quatro milhões, cento e quarenta e dois mil, trezentos e dois reais e vinte nove centavos) e em favor do Fundo Estadual de Assistência Social - FEAS no valor de R$ 260.325,00 (duzentos e sessenta mil e trezentos e vinte cinco reais), para os fins que especifica e dá outras providências.";"Goiás";"Estadual";"Lei";NA;NA;NA;2020-07-27
"Decreto Nº 9700 de 27 de julho de 2020";"Goiás";"Altera o sistema de revezamento implementado no art. 2º do Decreto nº 9.653, de 19 de abril de 2020, com a redação dada pelo Decreto nº 9.685, de 29 de junho de 2020.";"Goiás";"Estadual";"Decreto";NA;NA;NA;2020-07-27
"Lei Ordinária Nº 20809 de 15 de julho de 2020";"Goiás";"Institui a Política Estadual DÊ UMA FORÇA PARA GOIÁS, no prazo que especifica, no âmbito do Estado de Goiás e dá outras providências.";"Goiás";"Estadual";"Lei";NA;NA;NA;2020-07-15
"Lei Ordinária Nº 20810 de 15 de julho de 2020";"Goiás";"Institui a Política Estadual NA HORA DE ABASTECER, ESCOLHA ETANOL, no prazo que especifica, no âmbito do Estado de Goiás e dá outras providências.";"Goiás";"Estadual";"Lei";NA;NA;NA;2020-07-15
"Decreto Nº 9695 de 14 de julho de 2020";"Goiás";"Concede a Medalha da Ordem do Mérito Dom Pedro II às autoridades civis e militares que especifica.";"Goiás";"Estadual";"Decreto";NA;NA;NA;2020-07-14
"Decreto Nº 9693 de 14 de julho de 2020";"Goiás";"Concede a Medalha da Ordem do Mérito Tiradentes às autoridades militares, civis e eclesiásticas que especifica.";"Goiás";"Estadual";"Decreto";NA;NA;NA;2020-07-14
"Decreto Nº 9692 de 13 de julho de 2020";"Goiás";"Altera o Decreto nº 9.653, de 19 de abril de 2020.";"Goiás";"Estadual";"Decreto";NA;NA;NA;2020-07-13
"Decreto Nº 9691 de 8 de julho de 2020";"Goiás";"Declara, no âmbito do território estadual, estado de calamidade pública, em razão dos impactos socioeconômicos, financeiros e no sistema de saúde público decorrentes da pandemia causada pelo novo coronavírus (COVID-19).";"Goiás";"Estadual";"Decreto";NA;NA;NA;2020-07-08
"Decreto Nº 9687 de 1 de julho de 2020";"Goiás";"Dispõe sobre a suspensão dos prazos de processos administrativos no âmbito da administração direta e indireta do Estado de Goiás, nos termos que especifica.";"Goiás";"Estadual";"Decreto";NA;NA;NA;2020-07-01
"Decreto Nº 9685 de 29 de junho de 2020";"Goiás";"Altera o Decreto nº 9.653, de 19 de abril de 2020.";"Goiás";"Estadual";"Decreto";NA;NA;NA;2020-06-29
"Decreto Nº 9674 de 10 de junho de 2020";"Goiás";"Dispõe sobre a limitação de atividades na região do Rio Araguaia que impliquem em aglomeração de pessoas para lazer e turismo, como forma de combate à disseminação da COVID-19 no Estado de Goiás.";"Goiás";"Estadual";"Decreto";NA;NA;NA;2020-06-10
"Lei Ordinária Nº 20793 de 9 de junho de 2020";"Goiás";"Dispõe sobre a criação de Fundo Rotativo, no âmbito da Secretaria de Estado de Desenvolvimento e Inovação - SEDI, e dá outras providências.";"Goiás";"Estadual";"Lei";NA;NA;NA;2020-06-09
"Lei Ordinária Nº 10483 de 11 de maio de 2020";"Goiânia";"Altera a Lei nº 8.546, de 23 de julho de 2007 que Dispõe sobre a contratação por tempo determinado para atender a necessidade temporária de excepcional interesse público, nos termos do art. 37, inciso IX, da Constituição Federal e dá outras providências.";"Goiás";"Municipal";"Lei";52;"Centro Goiano";5208707;2020-05-11
"Lei Ordinária Nº 20773 de 8 de maio de 2020";"Goiás";"Institui o Regime Extraordinário de Licenciamento Ambiental - REL como medida de enfrentamento da situação extrema de âmbito econômico no Estado de Goiás, provocada em razão da decretação de estado de calamidade pública, decorrente da infecção humana pelo Novo Coronavírus (COVID-19).";"Goiás";"Estadual";"Lei";NA;NA;NA;2020-05-08
"Decreto Nº 9655 de 23 de abril de 2020";"Goiás";"Dispõe sobre a possibilidade de os servidores públicos se tornarem voluntários para prestação de serviços humanitários ou trabalhos sociais, em razão da pandemia causada pelo novo coronavírus (COVID-19).";"Goiás";"Estadual";"Decreto";NA;NA;NA;2020-04-23
"Decreto Nº 9653 de 19 de abril de 2020";"Goiás";"Dispõe sobre a decretação de situação de emergência na saúde pública do Estado de Goiás, em razão da disseminação do novo coronavírus COVID-19.";"Goiás";"Estadual";"Decreto";NA;NA;NA;2020-04-19
"Decreto Nº 9645 de 3 de abril de 2020";"Goiás";"Altera o Decreto nº 9.633, de 13 de março de 2020.";"Goiás";"Estadual";"Decreto";NA;NA;NA;2020-04-03
"Decreto Nº 9644 de 26 de março de 2020";"Goiás";"Altera o Decreto nº 9.633, de 13 de março de 2020.";"Goiás";"Estadual";"Decreto";NA;NA;NA;2020-03-26
"Decreto Nº 9643 de 25 de março de 2020";"Goiás";"Regulamenta o programa de alimentação escolar da rede pública de ensino durante o período de suspensão das aulas para enfrentamento ao COVID-19, e dá outras providências.";"Goiás";"Estadual";"Decreto";NA;NA;NA;2020-03-25
"Decreto Nº 9638 de 20 de março de 2020";"Goiás";"Altera o Decreto nº 9.633, de 13 de março de 2020, e dá outras providências.";"Goiás";"Estadual";"Decreto";NA;NA;NA;2020-03-20
"Decreto Nº 9637 de 17 de março de 2020";"Goiás";"Altera o Decreto nº 9.633, de 13 de março de 2020.";"Goiás";"Estadual";"Decreto";NA;NA;NA;2020-03-17
"Decreto Nº 9633 de 13 de março de 2020";"Goiás";"Dispõe sobre a decretação de situação de emergência na saúde pública do Estado de Goiás, em razão da disseminação do novo coronavírus (2019-nCoV).";"Goiás";"Estadual";"Decreto";NA;NA;NA;2020-03-13
"Decreto Nº 9634 de 13 de março de 2020";"Goiás";"Estabelece os procedimentos preventivos de emergência a serem adotados pelo Poder Executivo do Estado de Goiás e seus servidores, em razão de pandemia do novo coronavírus (COVID-19).";"Goiás";"Estadual";"Decreto";NA;NA;NA;2020-03-13
"Decreto Nº 36045 de 13 de agosto de 2020";"Maranhão";"Altera o Decreto nº 35.831, de 20 de maio de 2020, que reitera o estado de calamidade pública em todo o Estado do Maranhão para fins de prevenção e enfrentamento à COVID-19, estabelece as medidas sanitárias gerais e segmentadas destinadas à contenção do Coronavírus (SARS-CoV-2), e dá outras providências.";"Maranhão";"Estadual";"Decreto";NA;NA;NA;2020-08-13
"Lei Ordinária Nº 11321 de 11 de agosto de 2020";"Maranhão";"Altera a Lei nº 6.915, de 11 de abril de 1997, que dispõe sobre a contratação, por tempo determinado, de pessoal para atender a necessidade temporária de excepcional interesse público, nos termos do inciso IX do art. 19, da Constituição Estadual, e dá outras providências.";"Maranhão";"Estadual";"Lei";NA;NA;NA;2020-08-11
"Decreto Nº 36018 de 7 de agosto de 2020";"Maranhão";"Altera o Decreto nº 35.831, de 20 de maio de 2020, que reitera o estado de calamidade pública em todo o Estado do Maranhão para fins de prevenção e enfrentamento à COVID-19, estabelece as medidas sanitárias gerais e segmentadas destinadas à contenção do Coronavírus (SARS-CoV-2), e dá outras providências.";"Maranhão";"Estadual";"Decreto";NA;NA;NA;2020-08-07
"Lei Ordinária Nº 11310 de 4 de agosto de 2020";"Maranhão";"Altera a Lei nº 6.915, de 11 de abril de 1997, que dispõe sobre a contratação, por tempo determinado, de pessoal para atender a necessidade temporária de excepcional interesse público, nos termos do inciso IX do art. 19, da Constituição Estadual, e dá outras providências.";"Maranhão";"Estadual";"Lei";NA;NA;NA;2020-08-04
"Lei Ordinária Nº 11301 de 22 de julho de 2020";"Maranhão";"Institui a obrigatoriedade às Instituições Particulares de Ensino de promover Atividade de Acolhimento Socioemocional no retorno do Isolamento Social da Pandemia Covid-19, no âmbito do Estado do Maranhão.";"Maranhão";"Estadual";"Lei";NA;NA;NA;2020-07-22
"Lei Ordinária Nº 11302 de 22 de julho de 2020";"Maranhão";"Dispõe sobre medida de proteção aos maranhenses, durante o Plano de Contingência do Governo do Estado do Maranhão.";"Maranhão";"Estadual";"Lei";NA;NA;NA;2020-07-22
"Decreto Nº 35831 de 20 de maio de 2020";"Maranhão";"Reitera o estado de calamidade pública em todo o Estado do Maranhão para fins de prevenção e enfrentamento à COVID-19, estabelece as medidas sanitárias gerais e segmentadas destinadas à contenção do Coronavírus (SARS-CoV-2), e dá outras providências.";"Maranhão";"Estadual";"Decreto";NA;NA;NA;2020-05-20
